book no.,Year,sentence
volume56_book_256.txt,"November 16, 1933","Imperfect as I am, I would not have you to become a partner in my errors."
volume56_book_256.txt,"November 16, 1933","You must, therefore, exercise your full judgment in everything you do in association with me."
volume56_book_256.txt,"November 16, 1933","My love for you will be none the less for your differing with me when you feel the need for difference in thought, speech or action."
volume56_book_256.txt,"November 16, 1933",I have not put before you one more thing that I have stated in my letter to Elizabeth.
volume56_book_256.txt,"November 16, 1933",I would simply state the proposition without arguing it.
volume56_book_256.txt,"November 16, 1933","I believe that, when husband and wife profess a different faith, the progeny should be brought up in the faith of the husband."
volume56_book_256.txt,"November 16, 1933","There are, to me, sound religious and philosophic reasons for this proposition."
volume56_book_256.txt,"November 16, 1933","If this proposition does not appear to be sound, you should ask Elizabeth to show you my letter to her."
volume56_book_256.txt,"November 16, 1933",I am working just now under tremendous strain.
volume56_book_256.txt,"November 16, 1933",I get very little time for carrying on correspondence.
volume56_book_256.txt,"November 16, 1933","This letter too, I am dictating under trying circumstances."
volume56_book_256.txt,"November 16, 1933","I would, therefore, like you, if you think it wise, to share this letter with Elizabeth as also Manu."
volume56_book_256.txt,"November 16, 1933","But, if you think it wise not [to] do so, please tell both 1 Perhaps the sentence should read: And I [am] myself much less [inclined to] reconcile ourselves to Manu having [to] lower his ideal for the sake of Elizabeth."
volume56_book_256.txt,"November 16, 1933","LETTER TO MANU GANDHI 237 of them that I have their joint letter as also Elizabeth's previous letter, both of which I appreciate and about which I have written to you."
volume56_book_256.txt,"November 16, 1933",I hope you received my letter wherein the  15 sent by you were acknowledged.
volume56_book_256.txt,"November 16, 1933",I cannot warn you too often against unduly denying yourself.
volume55_book_235.txt,"June 15, 1933","LETTER TO C. F. ANDREWS 'PARNAKUTI', POONA 6, June 15, 1933 MY DEAR CHARLIE, As soon as I was able I wanted to deal with two of your important letters."
volume55_book_235.txt,"June 15, 1933","Your telegram and your letters 2 have helped me greatly, but I must not deal with the past for I have still to be miserly in the expenditure of my energy."
volume55_book_235.txt,"June 15, 1933",I am glad you are there able to look after your brother to a certain extent.
volume55_book_235.txt,"June 15, 1933","You were quite right 3 in thinking that, if I thought that your presence was necessary here, I would at once write or cable as the occasion required."
volume55_book_235.txt,"June 15, 1933",But I am more than convinced that your place is essentially there.
volume55_book_235.txt,"June 15, 1933","I am not so sanguine as you are, as to your influence."
volume55_book_235.txt,"June 15, 1933",The meaning I put upon the India Office listening to you is that they are much more courteous than they used to be.
volume55_book_235.txt,"June 15, 1933",I want you there for a higher purpose and a higher influence.
volume55_book_235.txt,"June 15, 1933","You being there are able to hold 1 Mahadev Desai's postscript to this letter read: ""There is just a minute to add a postscript."
volume55_book_235.txt,"June 15, 1933",The milk treatment consists of feeds of 6 to 8 ounces every three quarters of an hour.
volume55_book_235.txt,"June 15, 1933",The milk is unboiled.
volume55_book_235.txt,"June 15, 1933",Goats are milked early morning after the udders are properly washed with permanganate of potash and the milkman's hands washed with hot water.
volume55_book_235.txt,"June 15, 1933",The milk is then kept in a nice refrigerator and keeps wonderfully cool and tastes very nice.
volume55_book_235.txt,"June 15, 1933",From today Bapu has been allowed to add two dates to each feed.
volume55_book_235.txt,"June 15, 1933","3 The source has ""write""."
volume55_book_235.txt,"June 15, 1933",LETTER TO C. F. ANDREWS 197 together all those who are friendly to the cause and what is more you must be silently and imperceptibly permeating the best English mind with the truth that is in you.
volume55_book_235.txt,"June 15, 1933",All this will tell in the end.
volume55_book_235.txt,"June 15, 1933","Whilst God is great and omnipotent and works in mysterious ways and therefore all things are possible for Him, humanly speaking I see not the slightest immediate cause for hope of improvement in the present position which so far as I can see is as bad as it can possibly be."
volume55_book_235.txt,"June 15, 1933",This Ordinance rule has struck the people dumb.
volume55_book_235.txt,"June 15, 1933",The ignorant mass have become terror-struck.
volume55_book_235.txt,"June 15, 1933",They do not know what is in store for them on the morrow.
volume55_book_235.txt,"June 15, 1933",The well-to-do are trembling in their shoes simply through a vague fear of their being overtaken by some Governmental Act.
volume55_book_235.txt,"June 15, 1933",They feel that their only safety lies in an abject surrender to the will of what to them is a power which seems even to override Providence itself-a power that will compel subjection to its will at any cost.
volume55_book_235.txt,"June 15, 1933","And so there is a kind of dead calm which even in my bed, isolated though I am from contact with people through the orders of doctors, I can't help sensing."
volume55_book_235.txt,"June 15, 1933",It is the peace of the cemetery as Lord Irwin once or twice said in 1930 when he refused to make further use of the terrible powers which it was possible for the Government of India to use whenever they liked.
volume55_book_235.txt,"June 15, 1933","Though therefore I see no hope in the near future, whilst you and I do not ignore it, we have in view the distances in working for and at truth."
volume55_book_235.txt,"June 15, 1933","Time does not count, or if it does, it counts in our favour."
volume55_book_235.txt,"June 15, 1933","For here there is all hope, no cause for despair, for there is a certainty of the final triumph of truth, so long as there is some living representative of it."
volume55_book_235.txt,"June 15, 1933","Thanks be to God, so far as I can see there are certainly several, if not many, representatives of truth today in India who will count no cost too great for the vindication of truth."
volume55_book_235.txt,"June 15, 1933","Having got this immovable faith in me in the rightness of the cause, there is no danger on this side of any precipitate action."
volume55_book_235.txt,"June 15, 1933",Every step that is necessary will be taken with the greatest deliberation.
volume55_book_235.txt,"June 15, 1933",I shall personally leave no stone unturned to secure an honourable peace.
volume55_book_235.txt,"June 15, 1933","So far as I can judge I shall fail, but that does not worry me."
volume55_book_235.txt,"June 15, 1933","The harder General Smuts became the harder and the oftener I knocked at his door till it was banged in my face, but patience was rewarded and so it will be in this case."
volume55_book_235.txt,"June 15, 1933",Abdul Ghaffar Khan cannot be sacrificed.
volume55_book_235.txt,"June 15, 1933","Khorshed Naoroji over 30 years in age, a woman free of hysterics, full of faith and spirituality, went to the Frontier, lived with Abdul Ghaffar Khan, came in intimate touch with people."
volume55_book_235.txt,"June 15, 1933","Devdas next went and both these told me that they 198 THE COLLECTED WORKS OF MAHATMA GANDHI were convinced that there was no guile about Abdul Ghaffar Khan, that he always said what he meant and meant what he said."
volume55_book_235.txt,"June 15, 1933","They admit that he is hot-tempered, hasty in action, but has no belief in violence, is in secret league with neither Amanullah nor anybody else."
volume55_book_235.txt,"June 15, 1933",His sole ambition is to see his people happy and free from terrorism.
volume55_book_235.txt,"June 15, 1933",My own personal experience is that he is amenable to control and discipline.
volume55_book_235.txt,"June 15, 1933",I do not remember his having ever refused to carry out his promises.
volume55_book_235.txt,"June 15, 1933",He has come to me whenever I have wanted him.
volume55_book_235.txt,"June 15, 1933",My own firm opinion is that he is much misrepresented in the official circles and that what they do not want is his influence among his people.
volume55_book_235.txt,"June 15, 1933","This he undoubtedly has, because he is self-sacrificing, simple and brave."
volume55_book_235.txt,"June 15, 1933",It is once more a repetition of the old policy of cutting off tall poppies.
volume55_book_235.txt,"June 15, 1933","If what is insinuated about Abdul Ghaffar Khan is true, that must be proved by an impartial tribunal and neither the Congress nor I personally would have anything to say if the charges against him are true."
volume55_book_235.txt,"June 15, 1933",But the tribunal must be an acceptable tribunal.
volume55_book_235.txt,"June 15, 1933",I do not want a second edition of the Meerut Case1.
volume55_book_235.txt,"June 15, 1933","As you know full well I have no sympathy with Communism, most of the Meerut prisoners were daggers at me."
volume55_book_235.txt,"June 15, 1933",They missed no occasion to vilify or insult me.
volume55_book_235.txt,"June 15, 1933",But that is of no consequence.
volume55_book_235.txt,"June 15, 1933","They have been punished for holding particular opinions, not for any act that they have done!"
volume55_book_235.txt,"June 15, 1933",And what a punishment!
volume55_book_235.txt,"June 15, 1933",But that is merely symptomatic of the deep-seated disease.
volume55_book_235.txt,"June 15, 1933","There is no intention whatsoever on the part of the Indian Civil Service to give up power and all it means, nor for that matter is there any intention on the part of Mr. Baldwin or Sir Samuel Hoare to do otherwise."
volume55_book_235.txt,"June 15, 1933",Now for your important argument about untouchability.
volume55_book_235.txt,"June 15, 1933",But there is this initial flaw about it.
volume55_book_235.txt,"June 15, 1933",My life is one indivisible whole.
volume55_book_235.txt,"June 15, 1933","It is not built after the compartmental system-satyagraha, civil resistance, untouchability, Hindu-Muslim unity and several other things I could name are not different things to be taken and handled."
volume55_book_235.txt,"June 15, 1933",They are indivisible parts of a whole which is truth.
volume55_book_235.txt,"June 15, 1933","I can't devote myself entirely to untouchability 1 Meerut Conspiracy Case, in which Justice Yorke found the Communist International in Russia responsible for armed risings with a view to overthrowing existing Governments for establishing Soviet Republics by means of inciting antagonism between capital and labour, conducting strikes, etc."
volume55_book_235.txt,"June 15, 1933","The judgment pronounced the accused guilty of taking part in this conspiracy, which aimed at depriving the King of the Sovereignty of British India, and convicted 27 out of the 30 accused to sentences ranging from transportation for life to rigorous imprisonment for three years."
volume55_book_235.txt,"June 15, 1933",TELEGRAM TO RAMAKRISHNADAS CHANDIWALA 199 and say: 'Neglect Hindu-Muslim unity or swaraj.'
volume55_book_235.txt,"June 15, 1933",All these things run into one another and are inter-dependent.
volume55_book_235.txt,"June 15, 1933","You will find at one time in my life an emphasis on one thing, at another time on other."
volume55_book_235.txt,"June 15, 1933","But that is just like a pianist, now emphasizing one note and now other."
volume55_book_235.txt,"June 15, 1933",But they are all related to one another.
volume55_book_235.txt,"June 15, 1933",Therefore you see how it is utterly impossible for me to say: 'I have now nothing to do with civil disobedience or swaraj!'
volume55_book_235.txt,"June 15, 1933","Not only so, if 1 attempted any such thing, 1 could not do it."
volume55_book_235.txt,"June 15, 1933","Full and final removal of untouchability 1 can show you to your satisfaction, is utterly impossible without swaraj."
volume55_book_235.txt,"June 15, 1933","This letter will be too long and unnecessarily so, if 1 gave you chapter and verse to prove my statement."
volume53_book_16.txt,"January 11, 1933","LETTER TO RANCHHODDAS PATWARI January 11, 1933 RESPECTED RANCHHODBHAI1, I was pained to read your letter."
volume53_book_16.txt,"January 11, 1933",Is it not strange that you should write to me in English?
volume53_book_16.txt,"January 11, 1933",Or that you should frame questions as if you wanted to catch in your trap a witness who was trying to escape it?
volume53_book_16.txt,"January 11, 1933","But, as an elder brother, you have a right to do all that, for I could judge from our discussion 2 that you believed me to have completely forsaken dharma."
volume53_book_16.txt,"January 11, 1933","However, if God grants you a long life you will admit one day that I had not knowingly done so."
volume53_book_16.txt,"January 11, 1933",I will now reply to your questions.
volume53_book_16.txt,"January 11, 1933",3 Pranams from MOHANDAS 1.
volume53_book_16.txt,"January 11, 1933",You desire that each and every sanatanist Hindu should form and express his opinion on this question according to the dictates of his conscience.
volume53_book_16.txt,"January 11, 1933",I would welcome it if it were possible.
volume53_book_16.txt,"January 11, 1933","1 Ex-Dewan of Morvi State 2 On January 7, 1933 3 The questions are reproduced from the addressee's letter dated January 9, 1933 (S.N."
volume53_book_16.txt,"January 11, 1933",13 14 THE COLLECTED WORKS OF MAHATMA GANDHI 2.
volume53_book_16.txt,"January 11, 1933",Is it not a fact that there are thousands of people who believe that India cannot get real swaraj without you?
volume53_book_16.txt,"January 11, 1933","If it is so, I would regard that as a heavy responsibility on me."
volume53_book_16.txt,"January 11, 1933",Is it not a fact that there are thousands of people who value your life more than what they consider to be their religion?
volume53_book_16.txt,"January 11, 1933",I would be much pained if this is true.
volume53_book_16.txt,"January 11, 1933",I cannot endure anybody giving up what he regards as his dharma in order to save my life.
volume53_book_16.txt,"January 11, 1933",Where was the need of announcing your firm resolve to fast to death if the Guruvayur Temple was not opened to the untouchables?
volume53_book_16.txt,"January 11, 1933",This I have discussed at great length in my articles1.
volume53_book_16.txt,"January 11, 1933",Why did you not issue a referendum 2 without taking such a vow?
volume53_book_16.txt,"January 11, 1933",To this too my articles contain a satisfactory reply.
volume53_book_16.txt,"January 11, 1933",Did not the persons who were engaged in taking votes exploit your vow?
volume53_book_16.txt,"January 11, 1933",What you believe is not altogether improbable.
volume53_book_16.txt,"January 11, 1933",Can you correctly ascertain the percentage of voters who voted in favour of the entry on account of your vow before them?
volume53_book_16.txt,"January 11, 1933",It is impossible to reply to this without knowing what is in the heart of the person concerned.
volume53_book_16.txt,"January 11, 1933","If your case is strong and the cause you advocate is just and reasonable, why have you announced your vow to fast to death if His Excellency the Viceroy does not sanction the Bill3 before him?"
volume53_book_16.txt,"January 11, 1933",It is absolutely necessary to read my articles for a reply to this question.
volume53_book_16.txt,"January 11, 1933","1 Statements which Gandhiji started issuing from prison from November 4, 1932; vide Vols."
volume53_book_16.txt,"January 11, 1933",2 In Ponnani taluk where the Guruvayur temple is situated.
volume53_book_16.txt,"January 11, 1933","The Zamorin of Calicut, a trustee of the Temple, being against temple-entry, the referendum was taken amidst adverse influences."
volume53_book_16.txt,"January 11, 1933","3 Two Bills were awaiting Viceroy's sanction, one for introduction in the Central Legislative Assembly by Ranga Iyer and the other for introduction in the Madras Council by Dr. Subbaroyan."
volume53_book_16.txt,"January 11, 1933","On January 23, the Viceroy gave his sanction to the introduction of the Untouchability Abolition Bill by Ranga Iyer in the Assembly subject to the condition that the Government did not commit themselves to accepting its principles and that the fullest opportunity would be given to every section of the Hindu community to express an opinion on its provisions."
volume53_book_16.txt,"January 11, 1933",Sanction to Dr. Subbaroyan's Temple-Entry Bill in the Madras Council was refused on the ground that it was too far-reaching in implication for enactment by a provincial legislature.
volume53_book_16.txt,"January 11, 1933",Afterwards Ranga Iyer drafted a LETTER TO RANCHHODDAS PATWARI 15 9.
volume53_book_16.txt,"January 11, 1933",Do you know that this vow is being exploited for nourishing the agitation in favour of the Bill being sanctioned?
volume53_book_16.txt,"January 11, 1933",No such thing has happened to my knowledge.
volume53_book_16.txt,"January 11, 1933",Are you prepared to give up your vow and issue a fresh referendum in connection with the Guruvayur Temple?
volume53_book_16.txt,"January 11, 1933","If a systematic referendum is held with the Zamorin's co-operation and if he implements the result, my pledge will have been fulfilled."
volume53_book_16.txt,"January 11, 1933","Before issuing the referendum, did you frame definite rules as to who can rank as bona-fide worshipper of the deity for guidance of your men who were engaged in taking votes?"
volume53_book_16.txt,"January 11, 1933",12. Who can rank as a bona-fide worshipper of the deity according to you?
volume53_book_16.txt,"January 11, 1933","Those who, according to the present practice, are entitled to visit temples and who accept the necessity of worshipping in temples."
volume53_book_16.txt,"January 11, 1933",Did the persons engaged in taking votes ascertain by inquiry which of the voters were bona-fide worshippers of the deity?
volume53_book_16.txt,"January 11, 1933","Due publicity was given as to who were entitled to vote and leaflets were distributed to every home, and the people were then trusted to show regard for truth."
volume53_book_16.txt,"January 11, 1933","Can you say that a Hindu who does not visit a temple even once a month for darshan and who does not pay a single farthing as bhet or samagri 1 , can rank as a bona-fide worshipper of the deity?"
volume53_book_16.txt,"January 11, 1933","Certainly, if such Hindus believe in temples."
volume53_book_16.txt,"January 11, 1933","If the entry of the untouchables into temples depends on votes in a particular district, the condition precedent is that definite rules should be framed as to who can be treated as a bona-fide worshipper?"
volume53_book_16.txt,"January 11, 1933",Which of the temples would you treat as public?
volume53_book_16.txt,"January 11, 1933",Any temple which is not the property of an individual or of several individuals.
volume53_book_16.txt,"January 11, 1933","second Bill, based on Dr. Subbaroyan's, which the Viceroy permitted to be introduced in the Central Assembly, subject to the same qualifications as in the case of his former Bill."
volume53_book_16.txt,"January 11, 1933","The Temple-Entry Bill, as redrafted, was introduced in the Central Legislative Assembly on March 24, 1933."
volume53_book_16.txt,"January 11, 1933","Vide also ""Statement on Viceroy's Decision"", 24-1-1933."
volume53_book_16.txt,"January 11, 1933",1 Offerings 16 THE COLLECTED WORKS OF MAHATMA GANDHI 17.
volume53_book_16.txt,"January 11, 1933",Your parents were staunch followers of the Pushtimarga (a Vaishnavite Sampradaya).
volume53_book_16.txt,"January 11, 1933",Did they freely touch the untouchables?
volume53_book_16.txt,"January 11, 1933",Would they allow them to enter into temples?
volume53_book_16.txt,"January 11, 1933","You have never worn the sacred thread, VIZ., upavita."
volume53_book_16.txt,"January 11, 1933",You wore a tulsi-kanthi1 when you went to England in 1886.
volume53_book_16.txt,"January 11, 1933",When did you give up that kanthi?
volume53_book_16.txt,"January 11, 1933",I used to wear the sacred thread for some time.
volume53_book_16.txt,"January 11, 1933","I did not discard the tulsi-kanthi, but, after I had worn it for some years in South Africa, it left me, that is, it snapped."
volume53_book_16.txt,"January 11, 1933",Are you of the opinion that the wearing of a sacred thread or kanthi is not essential for a sanatanist Hindu?
volume53_book_16.txt,"January 11, 1933","I don't regard the practice as an essential requirement of sanatana dharma and so, when the kanthi snapped, I did not replace it."
volume53_book_16.txt,"January 11, 1933",During your stay in England you took meals in hotels or in the house of an Englishman?
volume53_book_16.txt,"January 11, 1933",Are you of the opinion that a Hindu does not cease to be a sanatanist Hindu by this?
volume53_book_16.txt,"January 11, 1933",That is my considered view.
volume53_book_16.txt,"January 11, 1933",Even now you have no objection to take the food prepared in European hotels or by a Christian or a Mohammedan?
volume53_book_16.txt,"January 11, 1933",I would have no objection if I otherwise regarded the article as acceptable food.
volume53_book_16.txt,"January 11, 1933","Are you in favour of the priti-bhojans 2 in which even the Brahmins, Dheds, Bhangis, Chamars, Mohammedans and Christians dine together?"
volume53_book_16.txt,"January 11, 1933",I oppose mixed dinners with Harijans as a part of the movement for the removal of untouchability.
volume53_book_16.txt,"January 11, 1933","If, however, the items are cooked with proper regard for rules of hygiene, I see nothing wrong in Harijans and others sitting together and eating from separate plates."
volume53_book_16.txt,"January 11, 1933",Will you say that the Hindus who take part in such priti-bhojans can claim to be sanatanist Hindus?
volume53_book_16.txt,"January 11, 1933","Provided the foregoing condition is observed, Hindus participating in mixed dinners with Harijans should be, ought to be, 1 String of tulsi beads 2 Mixed dinner parties with Harijans LETTER TO RANCHHODDAS PATWARI 17 regarded as sanatanist Hindus-if they have the other characteristics of such Hindus."
volume53_book_16.txt,"January 11, 1933","Are you in favour of intermarriages between the Brahmins, Kshatriyas and Vaishyas on the one hand and the untouchables on the other?"
volume53_book_16.txt,"January 11, 1933","If the bride and the bridegroom are a suitable pair, if their lives are pure and they believe in the ideal of self-control in married life, I would certainly approve of such unions."
volume53_book_16.txt,"January 11, 1933",But I do not regard interdining and intermarrying between Harijans and other Hindus as a necessary part of the movement for the eradication of untouchability.
volume53_book_16.txt,"January 11, 1933",Do you keep any idol or any picture of Shri Rama or Shri Krishna when you offer prayers in the morning and at night?
volume53_book_16.txt,"January 11, 1933",Are you a staunch believer in idol-worship?
volume53_book_16.txt,"January 11, 1933",Do you believe that it is necessary to go to a temple for darshan of the image for attaining emancipation and for acquiring supreme love for God?
volume53_book_16.txt,"January 11, 1933",How often have you visited the Hindu temples for the darshan of the idols during the last sixteen years?
volume53_book_16.txt,"January 11, 1933",I have visited them so often in the course of my tours that I cannot count the number of times.
volume53_book_16.txt,"January 11, 1933",What amount have you sent as bhet or samagri to temples from the funds collected by you?
volume53_book_16.txt,"January 11, 1933",I had no right to spend anything on temples from the money I had collected.
volume53_book_16.txt,"January 11, 1933","Do you believe that a Dhed, Bhangi or Chamar cannot attain emancipation or acquire supreme love for God unless he gets an opportunity to go into the Hindu temple for darshan?"
volume53_book_16.txt,"January 11, 1933",I don't believe so at all.
volume53_book_16.txt,"January 11, 1933","If you think that idol-worship is essential for the untouchables, what if separate temples are built for them with the idols of Shri Rama or Shri Krishna?"
volume53_book_16.txt,"January 11, 1933","Since I don't see any justification for the existence of a separate class of untouchable communities, I would not be satisfied by separate temples for them."
volume53_book_16.txt,"January 11, 1933",53-2 18 THE COLLECTED WORKS OF MAHATMA GANDHI 33.
volume53_book_16.txt,"January 11, 1933",Do you think that the worship of an idol in a public temple is more efficacious than that of an idol installed in the temple built for untouchables?
volume53_book_16.txt,"January 11, 1933","Has Mr. Kelappan1 or any Dhed, Bhangi or Chamar told you that he has such supreme love for the deity, that he will lose his life if he does not get darshan in a temple of the sanatanists?"
