book no.,Year,sentence
volume52_book_284.txt,"December 17, 1932",They either swear at me or enter into argument that has no bearing on the subject.
volume52_book_284.txt,"December 17, 1932",All this cannot be good for sanatan dharma.
volume52_book_284.txt,"December 17, 1932",The correspondence I am having is to me a painful sign of decadence of Hinduism.
volume52_book_284.txt,"December 17, 1932","I invite you to ponder over what I have written, and if you find any force in my argument, study the whole question dispassionately, and if you feel with me that untouchability is an evil, courageously proclaim the truth and fight the evil."
volume52_book_284.txt,"December 17, 1932",You refer me to the four Sankaracharyas.1 What shall I do by worrying them?
volume52_book_284.txt,"December 17, 1932",I entertain no doubt about the correctness of my position.
volume52_book_284.txt,"December 17, 1932",It is as clear to me as noon-day light.
volume52_book_284.txt,"December 17, 1932","If they think that I am immersed in darkness, it is for them to show me the light."
volume52_book_284.txt,"December 17, 1932","Yours sincerely, M. K. GANDHI SJT."
volume52_book_284.txt,"December 17, 1932","M. M. ANANTA RAU AGENT, SANATANA DHARMA AGENCY 40 ISHWARDAS LALA STREET, TRIPLICANE, MADRAS From a copy: C.W."
volume52_book_284.txt,"December 17, 1932",Courtesy: Government of Mysore.
volume52_book_284.txt,"December 17, 1932","18736 1 The addressee had written: ""You are eager to know about true orthodox opinion about the subject of untouchability."
volume52_book_284.txt,"December 17, 1932","You can do full justice to your desire to know this if you wire to (1) His Holiness Sri Sankaracharya Swami of Kamakotipeetam, now camping at Madras, (2) His Holiness the Jeer, Sri Ahobila Matam, Srirengam, (3) His Holiness Sri Sankaracharya Swami of Sarada Peetam, Sringeri, (4) His Holiness Sri Satyagnanatirtha Swami of Uttaradimatam, now camping at Benares, requesting them to send the best pundits amongst them under their nomination for the conference you intend holding."
volume52_book_284.txt,"December 17, 1932","Without this your true object cannot be fully fulfilled."""
volume50_book_456.txt,"August 26, 1932","LETTER TO D. B. KALELKAR August 26/27, 1932 CHI."
volume50_book_456.txt,"August 26, 1932","KAKA, After a long time and through Col. Doyle's kindness I got a letter from you, dated 1[6-8-1932]2."
volume50_book_456.txt,"August 26, 1932","The Colonel also told me today that you must have reached Ahmedabad today, and added that you should give up spinning, too, for some time in order to get rid of the pain in your back."
volume50_book_456.txt,"August 26, 1932",I promised to convey this to you and to advise you to give up spinning as long as the pain persists.
volume50_book_456.txt,"August 26, 1932","You should, therefore, give up spinning for some time."
volume50_book_456.txt,"August 26, 1932","If you can spin on the takli standing and without getting tired, as you used to do here, you may do so, but you need not do even 1 Some lines were censored by the jail authorities."
volume50_book_456.txt,"August 26, 1932",2 Illegible in the source LETTER TO D. B. KALELKAR 427 that.
volume50_book_456.txt,"August 26, 1932",The only thing which I insist on your doing just now is to improve your health and get strong.
volume50_book_456.txt,"August 26, 1932",Do get the area on the back where you feel the pain in the bone gently massaged.
volume50_book_456.txt,"August 26, 1932",It is very good indeed that you can bathe with cold water.
volume50_book_456.txt,"August 26, 1932",(Please let me know who are the other people with you there) .
volume50_book_456.txt,"August 26, 1932",.1 I am writing to Hiralal about the book on astronomy.
volume50_book_456.txt,"August 26, 1932",He has already sent me three of the books in your list.
volume50_book_456.txt,"August 26, 1932","They are as follows: Stellar Maps, Khagolchitram and Hindu Astronomy."
volume50_book_456.txt,"August 26, 1932",I am sending them with this.
volume50_book_456.txt,"August 26, 1932",There is some history behind Khagolchitram.
volume50_book_456.txt,"August 26, 1932",It was torn when it arrived here.
volume50_book_456.txt,"August 26, 1932",.2 I shall soon be having a fairly good collection of books on astronomy.
volume50_book_456.txt,"August 26, 1932",There are three books by Jeans which are worth reading.
volume50_book_456.txt,"August 26, 1932","If you have not read them, would you like me to send any of them?"
volume50_book_456.txt,"August 26, 1932",Hiralal has sent me Maeterlink's book at your suggestion.
volume50_book_456.txt,"August 26, 1932",I got it only two or three days ago.
volume50_book_456.txt,"August 26, 1932","Since it was sent at your suggestion, you must have read it of course."
volume50_book_456.txt,"August 26, 1932","If you want it, however, please let me know and I will send it too."
volume50_book_456.txt,"August 26, 1932",I can easily recognize the morning constellations whose names you have given.
volume50_book_456.txt,"August 26, 1932",You used to tell me names of many constellations but at that time they were only names to me.
volume50_book_456.txt,"August 26, 1932",Now I can recognize most of them.
volume50_book_456.txt,"August 26, 1932",I am able to read something at least every day.
volume50_book_456.txt,"August 26, 1932",I have glanced through the chapters you have written.
volume50_book_456.txt,"August 26, 1932","Though I have not read them carefully, I observed one deficiency in them."
volume50_book_456.txt,"August 26, 1932","I felt, after reading a short sketch of Sir William Hershel's life in Ball's Story of the Sky, that you should give the names and short lives of Western astronomers, some of whom, as you yourself say, were men of great courage and spirit and of noble character."
volume50_book_456.txt,"August 26, 1932",A modest effort to do this was made in Jyotirvilas.
volume50_book_456.txt,"August 26, 1932",The book on astronomy which we wish to publish should be as perfect as possible and should give an account of all discoveries to date in the field.
volume50_book_456.txt,"August 26, 1932","After reading the books of Jeans, I also feel that the book should give some knowledge about physics."
volume50_book_456.txt,"August 26, 1932",This means that the scope of your undertaking becomes a little wider.
volume50_book_456.txt,"August 26, 1932",I have merely thrown out a suggestion here.
volume50_book_456.txt,"August 26, 1932",I don't expect you to do all this while you are resting there.
volume50_book_456.txt,"August 26, 1932","Perhaps it is beyond your capacity, and so I do not wish to analyse your chapters too critically."
volume50_book_456.txt,"August 26, 1932","Moreover, the book should not be such as only highly educated persons can understand."
volume50_book_456.txt,"August 26, 1932",It should be written with villagers in view.
volume50_book_456.txt,"August 26, 1932",But you should attach more importance to your health than to even this undertaking.
volume50_book_456.txt,"August 26, 1932",You should go on with the work only if you can improve your health at the same time and not at its cost.
volume50_book_456.txt,"August 26, 1932",1&2 Two-and-a-half lines were censored by the jail authorities.
volume50_book_456.txt,"August 26, 1932",428 THE COLLECTED WORKS OF MAHATMA GANDHI How is it possible that I would not know Pundalik 1 ?
volume50_book_456.txt,"August 26, 1932",I don't think he is likely to have accompanied you there.
volume50_book_456.txt,"August 26, 1932",The disease from which he is suffering is an awful one.
volume50_book_456.txt,"August 26, 1932","I have no other remedy to suggest for it except fasting, cold hip-baths and enemas."
volume50_book_456.txt,"August 26, 1932",The lower intestines will recover their normal position only if they are given complete rest.
volume50_book_456.txt,"August 26, 1932",Pundalik's complaint is known as prolapsus of the rectum.
volume50_book_456.txt,"August 26, 1932",The effect of enema will be that the faeces will be expelled by the force of the water without the rectum slipping out.
volume50_book_456.txt,"August 26, 1932","And since he will be fasting, the intestines will have no work to do and the rectum will not then slip out."
volume50_book_456.txt,"August 26, 1932",I think you will get this letter without much delay.
volume50_book_456.txt,"August 26, 1932",Vallabhbhai's study of Sanskrit is progressing with the speed of Indra's horse.
volume50_book_456.txt,"August 26, 1932","As soon as spinning is over, he picks up a book of Sanskrit."
volume50_book_456.txt,"August 26, 1932",He has completed six parts of Satavlekar's series and two chapters of the Gita.
volume50_book_456.txt,"August 26, 1932",He does five verses every day.
volume50_book_456.txt,"August 26, 1932",He becomes equally absorbed in spinning.
volume50_book_456.txt,"August 26, 1932",He has reached as far as 40 counts.
volume50_book_456.txt,"August 26, 1932",I don't think any student of the Vidyapith can equal his capacity for hard work.
volume50_book_456.txt,"August 26, 1932",Mahadev's study of French and Urdu is progressing.
volume50_book_456.txt,"August 26, 1932",He has reached as far as 80 counts.
volume50_book_456.txt,"August 26, 1932","I had gone as far as 53 counts on the Gandiva spinning-wheel, but I have gone back to the Magan spinning-wheel to prevent harm to the left elbow."
volume50_book_456.txt,"August 26, 1932",I have not been able to rise above 30 counts on it.
volume50_book_456.txt,"August 26, 1932","In addition to astronomy, I also study Urdu a little."
volume50_book_456.txt,"August 26, 1932",Correspondence takes up a great deal of time.
volume50_book_456.txt,"August 26, 1932","After Dr. Mehta's death, I have had to write numerous letters concerning the affairs of his family."
volume50_book_456.txt,"August 26, 1932",I suppose you have heard about his death.
volume50_book_456.txt,"August 26, 1932",He had got a cut in a foot with a piece of glass and the wound became septic.
volume50_book_456.txt,"August 26, 1932",The leg had to be amputated.
volume50_book_456.txt,"August 26, 1932","The operation was successful, but afterwards he developed double pneumonia which proved fatal."
volume50_book_456.txt,"August 26, 1932",This is the fourth week since he died.
volume50_book_456.txt,"August 26, 1932",Maganlal (Dr. Mehta's) must have landed in Bombay today.
volume50_book_456.txt,"August 26, 1932",He had gone to England.
volume50_book_456.txt,"August 26, 1932",".2 Blessings from BAPU August 27, 1932 ."
volume50_book_456.txt,"August 26, 1932",.3 I had almost completed the history of the Ashram.
volume50_book_456.txt,"August 26, 1932","After revising what I had written, I was about to proceed further but had to leave the work aside."
volume50_book_456.txt,"August 26, 1932",I have not been able to find time for it since then.
volume50_book_456.txt,"August 26, 1932",I am trying to do so.
volume50_book_456.txt,"August 26, 1932","I have not been 1 Pundalik Katagde, follower of Gangadharrao Deshpande 2 Seven-and-a-quarter lines were censored by the jail authorities."
volume50_book_456.txt,"August 26, 1932",3 The first line was censored by the jail authorities.
volume50_book_456.txt,"August 26, 1932",LETTER TO CHHAGANLAL JOSHI 429 able to write it in as much detail as you may have thought.
volume50_book_456.txt,"August 26, 1932","I believe, however, that it will contain my views in brief on all matters."
volume53_book_6.txt,"January 11, 1933","LETTER TO T. A. V. NATHAN January 11, 1933 DEAR FRIEND, I have your letter1 enclosing three cuttings for which I thank you."
volume53_book_6.txt,"January 11, 1933",I take them in order of their dates.
volume53_book_6.txt,"January 11, 1933",That of the 28th December calls for no reply.
volume53_book_6.txt,"January 11, 1933","That of the 29th, that is, the one on the postponement 2 of the fast has led you to grant me an indulgence, because you have been averse to the method of the fast."
volume53_book_6.txt,"January 11, 1933","But I must not exist on indulgences from friends, especially in religious matters."
volume53_book_6.txt,"January 11, 1933","Fortunately for me, your indulgence is due to an oversight of a material condition, whose happening was to automatically postpone the fast, and this was some legal difficulty which could not be got over within the time."
volume53_book_6.txt,"January 11, 1933",This difficulty came in the shape of the want of Viceregal sanction.
volume53_book_6.txt,"January 11, 1933","If I had taken the fast on the 2nd of January, I am afraid that you would not only have condemned the fast as such but you would have condemned it as coercion against the Government of India."
volume53_book_6.txt,"January 11, 1933","So, you see that the fast is postponed, not because I have realized its uselessness, but because I have realized the sinfulness of taking it in spite of the supervening of a contingency that had been contemplated and provided for."
volume53_book_6.txt,"January 11, 1933","Your last article, that is, of the 4th instant, calls for a fairly large reply, but I shall not attempt it, if only because I have to economize time just at present."
volume53_book_6.txt,"January 11, 1933",I see in my proposal no surrender whatsoever of principle.
volume53_book_6.txt,"January 11, 1933","In this campaign I have endeavoured, as much as a Harijan by adoption can, to put myself in his position, and I say to the objectors: 'If you are polluted by my presence or by my touch, I am quite prepared to consent to a separate period being reserved for you to offer worship by yourselves."
volume53_book_6.txt,"January 11, 1933",I give you the same credit for sincerity that I claim for myself.
volume53_book_6.txt,"January 11, 1933",You are as much entitled to worship in the temple as I think I am.
volume53_book_6.txt,"January 11, 1933","Therefore you offer worship in your time, and I shall 1 In which the addressee had written: ""I feel you have let down the reformers by your compromise formula, and I hope you will excuse me when I say that the impression in enlightened circles in South India is that you have played into the hands of orthodox Brahmins."""
volume53_book_6.txt,"January 11, 1933","6 LETTER TO T. A. V. NATHAN 7 offer worship, along with the reformers, during the period reserved for us, and since by tradition you have been taught to think that the efficacy of the idol is diminished by my entering the portals of the temple gate, though I do not believe in it myself, let the priest perform the purification ceremony."
volume53_book_6.txt,"January 11, 1933",1 This is how I rehearsed the whole thing to myself before I made the proposal to Pandit Panchanan Tarkaratna.
volume53_book_6.txt,"January 11, 1933","Of course the proposal would not be worthy of consideration if there was not a big assumption underlying it, namely, that the objectors would be in a negligible minority."
volume53_book_6.txt,"January 11, 1933","My proposal, therefore, is an effective and acid test of the sincerity of all concerned."
volume53_book_6.txt,"January 11, 1933","If the objectors including the Shastris are sincere in their protest on behalf of what they consider to be sanatana dharma, they would jump at the proposal."
volume53_book_6.txt,"January 11, 1933","If the reformers and the Harijans are sincere, they should hail the proposal with joy, and if it is accepted, regard it as a vast step towards the fruition of the reform."
volume53_book_6.txt,"January 11, 1933","If it is found by experience that the caste Hindus who offer worship during the joint period are themselves a negligible quantity, it would be a defeat for the reformer, and it would be a sign that the Harijans should abstain from entering those temples where they are unwelcome visitors."
volume53_book_6.txt,"January 11, 1933",They would not then have to go to the temples as beggars before caste-men.
volume53_book_6.txt,"January 11, 1933","They will go, if they go at all, as fellow-Hindus, welcomed by an overwhelming majority of caste-men who would not consider themselves in any way polluted by the touch of the erstwhile untouchables."
volume53_book_6.txt,"January 11, 1933",Any other solution would be tantamount to compulsion.
volume53_book_6.txt,"January 11, 1933","You will recall what I said in one of my previous statements that wherever the majority of the temple-goers are against the admission of Harijans those temples should not be visited by them, and where the majority was composed of reformers, the possession should go to them along with the Harijans and that the minority should build another temple for themselves, if they so choose; but in the course of argument with Pandit Panchanan Tarkaratna, I discovered a flaw in that proposal."
volume53_book_6.txt,"January 11, 1933",It is an undoubted fact that-whether it is right or wrong is not the question-thousands of people attribute particular sanctity to their favourite temples.
volume53_book_6.txt,"January 11, 1933",That sanctity is for them an untransferable thing.
volume53_book_6.txt,"January 11, 1933","Sanctity handed down from ancient times cannot be imparted to a new image and a new temple by the mere will of man, and therefore the proposal I have now published dawned upon me, and the proposal to be of any value 1 Gandhiji's compromise proposed to satisfy caste Hindus."
volume53_book_6.txt,"January 11, 1933","8 THE COLLECTED WORKS OF MAHATMA GANDHI has to carry with it the consent to purification, again out of scrupulous regard for the religious sentiment of the minority."
volume53_book_6.txt,"January 11, 1933","You will sympathize with my reasoning, even if you may not agree with it, when you realize that ahimsa is a fundamental creed with me and enforceable under every conceivable circumstance."
volume53_book_6.txt,"January 11, 1933","That I may fail miserably in reducing my creed to practice on all occasions does not detract from the creed, and is irrelevant to the discussion; and my non-violence would not permit me to do violence to the feelings of a single devotee who has been accustomed to visit a particular temple."
volume53_book_6.txt,"January 11, 1933","I would also ask you to remember that, whatever may be said to the contrary, for me the whole of this campaign against untouchability is a purely religious campaign."
volume53_book_6.txt,"January 11, 1933","It is a movement of a big reform in Hinduism which, as I have said so repeatedly, must die if untouchability as we know it today is not eradicated."
volume53_book_6.txt,"January 11, 1933",I must also confess that I have a profound reverence for the Hindu Shastras as I have conceived them; but I cannot impose my conception upon others by force.
volume53_book_6.txt,"January 11, 1933",I must let it work its way in the midst of competing interpretations and conceptions.
volume53_book_6.txt,"January 11, 1933","Therefore wherever possible, my attitude would be to make provision for all other conceptions and interpretations."
volume53_book_6.txt,"January 11, 1933","If you would bear these things in mind, you would not only understand my position but you will support me whole-heartedly, and I want your support."
volume53_book_6.txt,"January 11, 1933",I want the support of every Hindu.
volume53_book_6.txt,"January 11, 1933","Your paper represents I know a very large body of advanced Hindu opinion and since you are taking the trouble of trying to understand me, I am not going easily to give up the attempt to enlist your full support."
volume53_book_6.txt,"January 11, 1933","You have asked me quite unjustly ""whether he (i.e., I) would be willing to satisfy the conscience of conservative seekers in England who want that political reform in India should be postponed to some later period""."
volume53_book_6.txt,"January 11, 1933","I will not insult your intelligence by showing you that there is no analogy between the position underlying your question and the position with reference to temple-entry, especially in view of what I have said in the foregoing paragraphs."
volume53_book_6.txt,"January 11, 1933","Lastly, you cavil at the use of the word 'Harijan' for untouchables."
volume53_book_6.txt,"January 11, 1933","Evidently, you do not know how the word came to be used in the first instance."
volume53_book_6.txt,"January 11, 1933","It was suggested by certain untouchable friends who do not like to be called 'untouchables', and it was suggested because a saintly poet1 of Gujarat, according to their interpretation of one of his hymns, used it in connection with 'untouchables'."
volume53_book_6.txt,"January 11, 1933","I 1 Narasinha Mehta LETTER TO ZAMINDAR OF GOLLAPALLI 9 immediately seized upon the word as also otherwise most fitting, for the most despised people are the most favoured of God."
volume53_book_6.txt,"January 11, 1933","I fail to see any slave mentality about the origin of the use of the word or its continuance, and let us hope that when untouchability has a decent burial, we shall all strive to become Harijans, that is, pure men of God."
volume53_book_465.txt,"February 19, 1933","LETTER TO D. B. KALELKAR AND B. D. KALELKAR February 19, 1933 CHI."
volume53_book_465.txt,"February 19, 1933","KAKA, I got your letter."
volume53_book_465.txt,"February 19, 1933","If milk, when taken without any other food, is not digested, it does no harm, but the milk which seems to be digested with the help of other food is not really digested but mixes with the food, and remaining in the body in the form of poison, it harms the gums, etc."
volume53_book_465.txt,"February 19, 1933",This is the view held by more and more doctors and seems to be correct.
volume53_book_465.txt,"February 19, 1933","You can have with milk oranges, grapes, pineapples, pomegranates and other juicy fruits."
volume53_book_465.txt,"February 19, 1933",They will prevent milk from causing constipation.
volume53_book_465.txt,"February 19, 1933","You should, therefore, start the experiment of milk-diet as soon as possible and accustom your body really to digest it."
volume53_book_465.txt,"February 19, 1933",I make no distinction between milk and curds.
volume53_book_465.txt,"February 19, 1933","Some doctors, probably most, believe that curds are more easily digested."
volume53_book_465.txt,"February 19, 1933",The curds should not taste sour at all-the curds which we used to make by adding drops of lemon juice to milk would be the best.
volume53_book_465.txt,"February 19, 1933",You should not drink the milk but sip it slowly.
volume53_book_465.txt,"February 19, 1933",It would be better to take a spoonful at a time.
volume53_book_465.txt,"February 19, 1933","To start with, you should take a quarter pound every hour."
volume53_book_465.txt,"February 19, 1933",Do not mind if you get diarrhoea.
volume53_book_465.txt,"February 19, 1933",It will stop in a few days.
volume53_book_465.txt,"February 19, 1933",You may drink the fruit juice separately at any convenient time.
volume53_book_465.txt,"February 19, 1933","In fruit juice, you should have the juice of six mosambis or of one pound of fresh grapes in two parts."
volume53_book_465.txt,"February 19, 1933","You should take about four pounds of milk or curds, and mix with it as much butter as may be necessary."
volume53_book_465.txt,"February 19, 1933","If you take milk in sufficient quantity, I doubt the necessity of butter."
volume53_book_465.txt,"February 19, 1933",But it will do no harm if it can be digested even in the absence of other food.
volume53_book_465.txt,"February 19, 1933","Doctors believe that, like milk, butter too does no harm if taken by itself."
volume53_book_465.txt,"February 19, 1933",See how I have described the benefits of milk.
volume53_book_465.txt,"February 19, 1933",But I have no choice.
volume53_book_465.txt,"February 19, 1933",I can find no plant or herb which can equal milk in food value.
volume53_book_465.txt,"February 19, 1933",There is certainly some truth in the belief that milk is a wholesome food even for yogis.
volume53_book_465.txt,"February 19, 1933",It is the only substitute for meat.
volume53_book_465.txt,"February 19, 1933","Only our vaids 1 could have discovered a vegetable substitute for milk, but, lacking zeal for dharma, they made no such attempt."
volume53_book_465.txt,"February 19, 1933",I have failed in my search and given it up.
volume53_book_465.txt,"February 19, 1933",We do 1 Physicians practising Ayurvedic system of medicine 347 348 THE COLLECTED WORKS OF MAHATMA GANDHI not know if anybody else will take it up and succeed.
volume53_book_465.txt,"February 19, 1933",Perhaps in the West they may succeed.
volume53_book_465.txt,"February 19, 1933",Among us there is no one who possesses the necessary medicinal knowledge to make such a discovery.
volume53_book_465.txt,"February 19, 1933",We do not regard it as our dharma to acquire such knowledge and to make experiments with that aim.
volume53_book_465.txt,"February 19, 1933",Anybody who wishes to undertake the task should be inspired with zeal for the welfare of the cow.
volume53_book_465.txt,"February 19, 1933",He should be convinced that no milk other than the mother's milk can be the proper food of a human being.
volume53_book_465.txt,"February 19, 1933",Such a person should then study medicine.
volume53_book_465.txt,"February 19, 1933",We do not have at present men with such a spirit.
volume53_book_465.txt,"February 19, 1933","If India is destined to discover such a substitute, God will send among us a person with the necessary gifts."
volume53_book_465.txt,"February 19, 1933","Till then, let us sing praises of milk and do the duty which lies before us."
