book no.,Year,sentence
volume57_book_121.txt,"February 5, 1934",.4 is correct.
volume57_book_121.txt,"February 5, 1934",".5 also has gone there now and Ramdas tells me that our 1 Rangaswamy Iyengar, editor of The Hindu, had died in the early morning of February 5."
volume57_book_121.txt,"February 5, 1934","2,4 & 5 The names are omitted in the source."
volume57_book_121.txt,"February 5, 1934","3 Thakkar Bapa 113 57-8 114 THE COLLECTED WORKS OF MAHATMA GANDHI Harilal, too, has been there."
volume57_book_121.txt,"February 5, 1934","He who has many sons and daughters should have a mother as well, shouldn't he!"
volume57_book_121.txt,"February 5, 1934",I think I have already written to you about the Zamorin.
volume57_book_121.txt,"February 5, 1934",He lives in utmost simplicity.
volume57_book_121.txt,"February 5, 1934",There is no ostentation at all.
volume57_book_121.txt,"February 5, 1934","His palace too is a palace only in name, and there is hardly any furniture."
volume57_book_121.txt,"February 5, 1934",He showed me the utmost courtesy.
volume57_book_121.txt,"February 5, 1934",I was introduced to his son.
volume57_book_121.txt,"February 5, 1934",He offered me coconut water and gave me fruit when I left.
volume57_book_121.txt,"February 5, 1934",He was very pleased that I confined the conversation to formal courtesies.
volume57_book_121.txt,"February 5, 1934",He is old and said that his memory was becoming weak.
volume57_book_121.txt,"February 5, 1934",He is a good man.
volume57_book_121.txt,"February 5, 1934",I am glad I called on him.
volume57_book_121.txt,"February 5, 1934",Coonoor is a beautiful place.
volume57_book_121.txt,"February 5, 1934","If one can get accommodation here, the daily necessities are cheap."
volume57_book_121.txt,"February 5, 1934",It is very cold in winter though not extremely so.
volume57_book_121.txt,"February 5, 1934",Our workers have been doing good work among the hill people.
volume57_book_121.txt,"February 5, 1934","I had received an invitation from them, and so I suggested that, if they wished to give me eight days' rest, they should let me have it in Coonoor so that I could work among the hill people and also dispose of the papers which had accumulated."
volume57_book_121.txt,"February 5, 1934",I am staying in Nagesvara Rao's bungalow here.
volume57_book_121.txt,"February 5, 1934",I am lodged above the garage.
volume57_book_121.txt,"February 5, 1934",It is a small but good room.
volume57_book_121.txt,"February 5, 1934",The garage can be used as a room.
volume57_book_121.txt,"February 5, 1934",My room above it is a clean one.
volume57_book_121.txt,"February 5, 1934",I am glad I came here.
volume57_book_121.txt,"February 5, 1934",The hill people come to see me every day.
volume57_book_121.txt,"February 5, 1934","In Ooty, on the nearby hill of Kotagiri, and here, we had large meetings such as had never taken place in these parts."
volume57_book_121.txt,"February 5, 1934",Deputations of Harijans came and met me.
volume57_book_121.txt,"February 5, 1934","There is a fine mutt exclusively for Harijans, which I visited."
volume57_book_121.txt,"February 5, 1934",The hill people are much addicted to drinking.
volume57_book_121.txt,"February 5, 1934",Our workers have been doing good work among them.
volume57_book_121.txt,"February 5, 1934",Raja will see me tomorrow.
volume57_book_121.txt,"February 5, 1934",Bihar has been receiving good help; people from all over the country have been sending money and clothes.
volume57_book_121.txt,"February 5, 1934","From the Ashram, Panditji1, Parnerkar2, Raojibhai3, Bal4 and others have gone there."
volume57_book_121.txt,"February 5, 1934",Swami5 and Dhotre also have gone.
volume57_book_121.txt,"February 5, 1934",Mathuradas has been planning to go and may go any day.
volume57_book_121.txt,"February 5, 1934","Others also are ready, but I have kept them back."
volume57_book_121.txt,"February 5, 1934",I will follow Rajendrababu's instructions.
volume57_book_121.txt,"February 5, 1934","Whether or not I should go, that also I have left to him."
volume57_book_121.txt,"February 5, 1934",I have told him that he may call me there whenever he wants me.
volume57_book_121.txt,"February 5, 1934",My own inclination is to go there after covering Karnataka and Orissa.
volume57_book_121.txt,"February 5, 1934",That will mean I shall reach there about 20th March.
volume57_book_121.txt,"February 5, 1934",I have been collecting money at every place I visit.
volume57_book_121.txt,"February 5, 1934",This time 1 Narayan Moreshwar Khare 2 Y. M. Parnerkar who managed the Ashram dairy 3 Raojibhai Nathabhai Patel 4 Bal Kalelkar 5 Swami Anandananda LETTER TO VALLABHBHAI PATEL 115 I come into contact only with people who give me coppers.
volume57_book_121.txt,"February 5, 1934","I do meet, of course, a few who belong to the middle class."
volume57_book_121.txt,"February 5, 1934",They give what they can.
volume57_book_121.txt,"February 5, 1934",But there is no limit to the generosity of the poor.
volume57_book_121.txt,"February 5, 1934",Every day hill women come and give me a few coins tied up in a corner of their saris.
volume57_book_121.txt,"February 5, 1934",Ramachandran of the Ashram is with me at present.
volume57_book_121.txt,"February 5, 1934",I am sure you know him.
volume57_book_121.txt,"February 5, 1934",He is a scholar and a fine man.
volume57_book_121.txt,"February 5, 1934",Jivaraj's health has been very much affected.
volume57_book_121.txt,"February 5, 1934",But he is a brave man and continues to look after the hospital.
volume57_book_121.txt,"February 5, 1934",At intervals he pays visits to Matheran and takes rest for a few days.
volume57_book_121.txt,"February 5, 1934",You must have heard about Perin1 and Jamnabehn.
volume57_book_121.txt,"February 5, 1934",Prema and Lilavati (Asar) went back [to jail] as soon as they were released.
volume57_book_121.txt,"February 5, 1934",Lilavati is an obstinate girl.
volume57_book_121.txt,"February 5, 1934",Perhaps she will die in jail.
volume57_book_121.txt,"February 5, 1934",She has taken ill.
volume57_book_121.txt,"February 5, 1934",Her loyalty is wonderful.
volume57_book_121.txt,"February 5, 1934",I am sending Amala just now to Sabarmati for Harijan work.
volume57_book_121.txt,"February 5, 1934",We will watch how she behaves there.
volume57_book_121.txt,"February 5, 1934",Bidaj also has been handed over to the Harijan Sevak Sangh.
volume57_book_121.txt,"February 5, 1934",It is intended to take the dairy back to the Harijan Ashram.
volume57_book_121.txt,"February 5, 1934",That will enable us to give training to some Harijans and ensure that the dairy is run well.
volume57_book_121.txt,"February 5, 1934",A copy of Ba's letter is enclosed.
volume57_book_121.txt,"February 5, 1934",Please convey to Mani whatever you can from this.
volume57_book_121.txt,"February 5, 1934",I have asked for permission to see her and Mahadev.
volume57_book_121.txt,"February 5, 1934",I have sent a wire.
volume57_book_121.txt,"February 5, 1934",A reply is expected in a day or two.
volume57_book_121.txt,"February 5, 1934",I will go there on the 6th March.
volume57_book_121.txt,"February 5, 1934",I also have heard about .
volume57_book_121.txt,"February 5, 1934",Tell Mani that Mridu has sent a long message for her: 'She still suffers from her disease.
volume57_book_121.txt,"February 5, 1934",She remembers Mani every day.
volume57_book_121.txt,"February 5, 1934",She expects to be free in March.
volume57_book_121.txt,"February 5, 1934","If Mani wants any other books, she may call for them."
volume57_book_121.txt,"February 5, 1934","She has had letters from Durga, Mani Parikh, Velanbehn and others."
volume57_book_121.txt,"February 5, 1934","After resting for some time, she hopes to return to jail.'"
volume57_book_121.txt,"February 5, 1934",Abbas Saheb's 80th birthday seems to have been celebrated with enthusiasm.
volume57_book_121.txt,"February 5, 1934",Kaka worked hard for that.
volume57_book_121.txt,"February 5, 1934",The old man was very much pleased.
volume57_book_121.txt,"February 5, 1934",Kalyanji 3 is writing a short biography of him.
volume57_book_121.txt,"February 5, 1934",All our men of letters visited him in this connection and refreshed the memory of half-forgotten old days.
volume57_book_121.txt,"February 5, 1934",I am glad that you are experimenting with neti 4 .
volume57_book_121.txt,"February 5, 1934",A wick made with hand from a piece of fine cloth may be found more useful.
volume57_book_121.txt,"February 5, 1934",It can suck up harmful matter.
volume57_book_121.txt,"February 5, 1934",You can make such a wick from your worn-out dhoti.
volume57_book_121.txt,"February 5, 1934",It is necessary to do pranayama exercises 1 Dadabhai Naoroji's grand-daughter 2 The name is omitted in the source.
volume57_book_121.txt,"February 5, 1934","3 Kalyanji V. Mehta, a well-known Congress worker 4 A Hathayoga practice for cleaning the nasal passage 116 THE COLLECTED WORKS OF MAHATMA GANDHI along with it."
volume57_book_121.txt,"February 5, 1934",Neti and pranayama will certainly help to keep the nostrils open.
volume57_book_121.txt,"February 5, 1934",I am glad that your constipation has disappeared.
volume57_book_121.txt,"February 5, 1934",I am sure the change which you have made in your food will benefit you.
volume57_book_121.txt,"February 5, 1934",Kelappan did not intentionally hide the fact of his relations with that lady.
volume57_book_121.txt,"February 5, 1934",He didn't think there was anything improper in it.
volume57_book_121.txt,"February 5, 1934","He also was influenced by ""Self-respect""1 and ""Jatpattod""2."
volume57_book_121.txt,"February 5, 1934",Nor is there anything against the lady.
volume57_book_121.txt,"February 5, 1934",Kelappan is not a bad man.
volume57_book_121.txt,"February 5, 1934",He is only simple-minded and also obstinate.
volume57_book_121.txt,"February 5, 1934",I wish to put Rajaji in charge of the work in Malabar.
volume57_book_121.txt,"February 5, 1934","I have not made up my mind finally, though."
volume57_book_121.txt,"February 5, 1934",I may also appoint Ramachandran instead.
volume57_book_121.txt,"February 5, 1934",Your plan for Aunt seems a good one.
volume57_book_121.txt,"February 5, 1934",Let her remain where she is.
volume57_book_121.txt,"February 5, 1934",Hasn't she been indiscreet enough?
volume57_book_121.txt,"February 5, 1934",But your fear is baseless.
volume57_book_121.txt,"February 5, 1934",The refreshment 3 served by Sir Chimanlal is not likely to contain much.
volume57_book_121.txt,"February 5, 1934","If most people don't relish what he serves, what can the poor man do?"
volume57_book_121.txt,"February 5, 1934",The visit to Bengal is still undecided.
volume57_book_121.txt,"February 5, 1934",I can't say what will finally happen.
volume57_book_121.txt,"February 5, 1934",I had a wire from Muriel [Lester].
volume57_book_121.txt,"February 5, 1934","I have asked her to come and see me near Coimbatore, and also suggested that she should tour with me for some time."
volume57_book_121.txt,"February 5, 1934",Amritlal Sheth 4 has not written to me recently.
volume57_book_121.txt,"February 5, 1934",He served an ultimatum on me too.
volume57_book_121.txt,"February 5, 1934","I don't mind, let the truth come out even from the bowels of the earth."
volume57_book_121.txt,"February 5, 1934",Isn't even man's body a piece of earth?
volume57_book_121.txt,"February 5, 1934",Blessings to you both from BAPU [PS.]
volume57_book_121.txt,"February 5, 1934",The frost has ruined crops all over the country this year.
volume57_book_121.txt,"February 5, 1934",In some parts it has been frost and in some other parts it has been unseasonable rains.
volume57_book_121.txt,"February 5, 1934",These things seem to have a direct connection with the earthquake.
volume57_book_259.txt,"March 6, 1934","LETTER TO SIR SAMUEL HOARE As AT WARDHA, (C.P. ), INDIA, March 6, 1934 DEAR SIR SAMUEL, You will recollect that whilst I was returning to India in December of 1931 you had a cable caused to be sent to me in regard to an interview alleged to have been given by me to a journalist in Rome and that I had sent a categorical denial.1 To this there was a counter-denial which I had not seen till recently, being in jail within less than one week of my landing in Bombay."
volume57_book_259.txt,"March 6, 1934","After my discharge from the last imprisonment in August last, I was told by Mirabai Slade that an English friendProf."
volume57_book_259.txt,"March 6, 1934","Maclean of Wilson College, Bombayhad thought that although the matter was stale, it was worth while my clearing it up, as the denial by the Rome journalist had created a profound impression at the time of its publication and had probably precipitated the Viceregal action against me in 1932."
volume57_book_259.txt,"March 6, 1934","Agreeing with Prof. Maclean, I at once asked Mirabai to write to Miss Agatha Harrison to procure the relevant newspaper cuttings."
volume57_book_259.txt,"March 6, 1934",After much search she was able to get them.
volume57_book_259.txt,"March 6, 1934",The last and the most important I received from her last month in the midst of my hurricane tour in the cause of the anti-untouchability campaign.
volume57_book_259.txt,"March 6, 1934","For ready reference, I send you copies of the three cuttings marked 'A', 'B' and 'C' respectively."
volume57_book_259.txt,"March 6, 1934",It should be noted that these cuttings were for the first time seen by me on their being received from Miss Harrison.
volume57_book_259.txt,"March 6, 1934","I have now read and reread them several times, and I have no hesitation in saying that 'A' and 'C' are a caricature of what took place."
volume57_book_259.txt,"March 6, 1934",A' professes to be a summary of a long statement said to have been made by me to an Italian journalist.
volume57_book_259.txt,"March 6, 1934","In 'C' The Times correspondent, on seeing my denial regarding the alleged interview, makes a halting admission that I might be correct in so far as Signor Gayda did not ""request any formal interview and no such interview was granted,"" but insists that the statements attributed to me were substantially correct."
volume57_book_259.txt,"March 6, 1934",But truth will perhaps be better served by my simply stating what I do know than by analysing 'A' and 'C'.
volume57_book_259.txt,"March 6, 1934",251 252 THE COLLECTED WORKS OF MAHATMA GANDHI 1.
volume57_book_259.txt,"March 6, 1934","I never made any statement, much less a long one, to Signor Gayda as suggested in 'A'."
volume57_book_259.txt,"March 6, 1934",I was never invited to meet Signor Gayda at any place.
volume57_book_259.txt,"March 6, 1934",But I was invited by an Italian friend to meet some Italian citizens at an informal drawing-room meeting at a private house.
volume57_book_259.txt,"March 6, 1934",At this meeting I was introduced to several friends whose names I cannot now recall and could not have recalled even the day after the meeting.
volume57_book_259.txt,"March 6, 1934",The introductions were merely formal.
volume57_book_259.txt,"March 6, 1934","At this meeting the conversation was general, and not addressed to any particular individual."
volume57_book_259.txt,"March 6, 1934",Questions were put by several friends and there was a random conversation as at all drawing-room meetings.
volume57_book_259.txt,"March 6, 1934",It was therefore wrong for Signor Gayda or The Times correspondent to reproduce my remarks as if they were one connected statement to one particular person.
volume57_book_259.txt,"March 6, 1934",Signor Gayda never showed to me for verification anything he might have taken down.
volume57_book_259.txt,"March 6, 1934","The conversation, among other things, referred to the Round Table Conference, my impression of it and my possible future action."
volume57_book_259.txt,"March 6, 1934",Many of the things that have been put into my mouth in 'A' I had never said.
volume57_book_259.txt,"March 6, 1934","All my hopes, fears and future intentions were expressed in as precise a language as it was possible for me to command and use in my speech at the close of the Round Table Conference."
volume57_book_259.txt,"March 6, 1934",Whatever I said in private conversation was but a paraphrase of the sentiments expressed in that speech.
volume57_book_259.txt,"March 6, 1934","I am not given to saying one thing in public and another in private, or to saying one thing to one friend and something else to another."
volume57_book_259.txt,"March 6, 1934","I could not have said that there was a definite rupture between the Indian nation and the British Government, for I had said to several friends about the same time that I was determined to strain every nerve to prevent a rupture and to continue the peaceful relations established by the Irwin-Gandhi Pact."
volume57_book_259.txt,"March 6, 1934","Being an optimist, I do not believe in a final rupture between human beings."
volume57_book_259.txt,"March 6, 1934",I never said that I was returning to India in order to restart the struggle against England.
volume57_book_259.txt,"March 6, 1934",Certain possibilities about which I was questioned at the informal meeting have been so described in 'A' as if I was actually going to India to bring them about if I could.
volume57_book_259.txt,"March 6, 1934",I would add that the public had neither the original notes supposed to have been made by Signor Gayda nor the latter's own version wherever published.
volume57_book_259.txt,"March 6, 1934",In 'A' and 'C' they had only the impressions of The Times correspondent about what Signor Gayda wrote or said.
volume57_book_259.txt,"March 6, 1934",LETTER TO HIRALAL SHARMA 253 I do not know how you were affected by 'C'.
volume57_book_259.txt,"March 6, 1934","If your faith in my denial was shaken, perhaps in any case I should have been acquainted with the rejoinder to my denial as you had kindly brought to my notice the first report."
volume57_book_259.txt,"March 6, 1934",I do not know how you will take this letter.
volume57_book_259.txt,"March 6, 1934","If you have any doubt about my bonafides, I would like to clear it, if it is at all possible for me to do so."
volume57_book_259.txt,"March 6, 1934","Miss Slade was the ""follower"" referred to in 'C'."
volume57_book_259.txt,"March 6, 1934",I enclose herewith her recollections of the conversation.1 I am not publishing this letter.
volume57_book_259.txt,"March 6, 1934",I am sending copies to several friends for their private use.
volume57_book_259.txt,"March 6, 1934","But I would like you, if you could, to give it publicity, or to ask Prof. C. F. Andrews,Woodbrooke, Selly Oak, Birmingham, to make such public use of the letter as he might wish."
volume58_book_447.txt,"September 5, 1934","LETTER TO VALLABHBHAI PATEL [Before] September [5], 1934 1 DEAR VALLABHBHAI, After much deliberation and discussions with friends who have been to Wardha recently, I have come to the conclusion that the best interests of the Congress and the nation will be served by my completely severing all official or physical connection with the Congress, including the original membership."
volume58_book_447.txt,"September 5, 1934",This does not mean that I cease to take any interest in an organization with which I have been intimately connected since 1920 and which I have worshipped since my youth.
volume58_book_447.txt,"September 5, 1934","In spite of all I have recently said about the corruption that has crept into the organization, 1 Gandhiji had been having discussions on his withdrawal from active leadership of the Congress; vide the following item."
volume58_book_447.txt,"September 5, 1934","In his letter dated August 20 to the addressee, Gandhiji had said that he would ""prepare a draft"" and send it to him."
volume58_book_447.txt,"September 5, 1934","This letter appears to be a draft of his ""Statement to the Press"" which was finally released on September 17, 1934; vide Vol."
volume58_book_447.txt,"September 5, 1934","404 THE COLLECTED WORKS OF MAHATMA GANDHI it still remains, in my opinion, the most powerful and the most representative national organization in the country."
volume58_book_447.txt,"September 5, 1934",It has a history of uninterrupted noble service and sacrifice from its inception.
volume58_book_447.txt,"September 5, 1934",Its progress has been unbroken and steady.
volume58_book_447.txt,"September 5, 1934",It has weathered storms as no other institution in the country has.
volume58_book_447.txt,"September 5, 1934",It has commanded the largest measure of sacrifice of which any country would be proud.
volume58_book_447.txt,"September 5, 1934",It has today the largest number of selfsacrificing men and women of unimpeachable character.
volume58_book_447.txt,"September 5, 1934",It is not with a light heart that I leave this great organization.
volume58_book_447.txt,"September 5, 1934",But I feel that my remaining in it any longer is likely to do more harm than good.
volume58_book_447.txt,"September 5, 1934",I miss at this juncture the association and advice of Jawaharlal who is bound to be the rightful helmsman of the organization in the near future.
volume58_book_447.txt,"September 5, 1934","I have, therefore, kept before me his great spirit."
volume58_book_447.txt,"September 5, 1934","And I feel that whilst his great affection for me would want to keep me in the Congress, his reason would endorse the step I have taken."
volume58_book_447.txt,"September 5, 1934","And since a great organization cannot be governed by affections but by cold reason, it is better for me to retire from a field where my presence results in arresting full play of reason."
volume58_book_447.txt,"September 5, 1934",Hence in leaving the organization I feel that I am in no sense deserting one who is much more than a comrade and whom no amount of political differences will ever separate from me.
volume58_book_447.txt,"September 5, 1934","Nor by retiring at this critical juncture am I less true to Babu Rajendra Prasad who will in all probability be the President of the forthcoming Congress, and who unlike Jawaharlal shares most of my ideals and whose sacrifice for the nation, judged whether in quality or quantity, is not to be excelled."
volume58_book_447.txt,"September 5, 1934","Then there is the Congress Parliamentary Board which would perhaps not have come into being, unless I had encouraged its formation with my whole heart."
volume58_book_447.txt,"September 5, 1934",It supplies a want that was felt by many staunch and true Congressmen.
volume58_book_447.txt,"September 5, 1934","It was necessary, therefore, to bring it into being."
volume58_book_447.txt,"September 5, 1934",Such services as I am capable of rendering will still be at its disposal as at any Congressman's.
volume58_book_447.txt,"September 5, 1934",It must command the full support of all Congressmen who have no insuperable objection to the entry of Congressmen into the existing legislatures.
volume58_book_447.txt,"September 5, 1934",I should be sorry if the Board lost a single vote because of my withdrawal.
volume58_book_447.txt,"September 5, 1934","I fear none of the consequences dreaded by some friends, for I know my ground."
volume58_book_447.txt,"September 5, 1934",A tree is no more hurt by a ripe fruit falling from it than would the Congress be by my going out of it.
volume58_book_447.txt,"September 5, 1934","Indeed the fruit will be dead weight, if it did not fall when it was fully ripe."
volume58_book_447.txt,"September 5, 1934",Mine is that condition.
volume58_book_447.txt,"September 5, 1934",I feel that I am a dead weight on the Congress now.
volume58_book_447.txt,"September 5, 1934",LETTER TO VALLABHBHAI PATEL 405 There is a growing and vital difference of outlook between many Congressmen and myself.
volume58_book_447.txt,"September 5, 1934",My presence more and more estranges the intelligentsia from the Congress.
volume58_book_447.txt,"September 5, 1934","I feel that my policies fail to convince their reason, though strange as it may appear, I do nothing that does not satisfy my own reason."
volume58_book_447.txt,"September 5, 1934","But my reason takes me in a direction just the opposite of what many of the most intellectual Congressmen would gladly and enthusiastically take, if they were not hampered by their unexampled loyalty to me."
volume58_book_447.txt,"September 5, 1934",No leader can expect greater loyalty and devotion than I have received from intellectually-minded Congressmen even when they have protested and signified their disapproval of the policies I have laid before the Congress.
volume58_book_447.txt,"September 5, 1934",I feel that for me any more to draw upon this loyalty and devotion is to put an undue strain upon them.
volume58_book_447.txt,"September 5, 1934",I wish that those who strongly disapprove of my method would outvote me and compel my retirement.
volume58_book_447.txt,"September 5, 1934",I have tried to reach that position but I have failed.
volume58_book_447.txt,"September 5, 1934",They would cling to me till the end.
volume58_book_447.txt,"September 5, 1934",The only way I can requite such loyalty is by voluntary retirement.
volume58_book_447.txt,"September 5, 1934",I cannot work in opposition when there are some fundamental differences between the Congress intelligentsia and me.
volume58_book_447.txt,"September 5, 1934",Ever since my entry into public life I have never acted in that manner.
volume58_book_447.txt,"September 5, 1934",1 Then there is the growing group of socialists.
volume58_book_447.txt,"September 5, 1934",Jawaharlal is their undisputed leader.
